<?xml version="1.0" encoding="UTF-8"?>
<!DOCTYPE aircraft-carrier SYSTEM "AircraftCarrier.dtd">
<?xml-stylesheet type="text/xsl" href="HTML_Transformation_1.xsl"?>

<aircraft-carrier engine = "nuclear" class = "USS Nimitz" years-of-service = "1975-present">
	<name>Nimitz</name>
	<personel>
		<soldier id = "s1" aircraft = "a4">
			<first-name>Takijiro</first-name>
			<last-name>Ohnishi</last-name>
			<gender>male</gender>
			<position>General</position>
			<age>36</age>
			<religion>Shinto</religion>
		</soldier>
	</personel>
	<aircrafts>
		<aircraft id = "a4" control = "pilot" role = "fighter">
			<model>F-15 Eagle</model>
			<manufacturer>
				<manufacturer-name>McDonnell Douglas</manufacturer-name>
				<established>28 April 1967</established>
				<staff-count>50000</staff-count>
				<profit>US$ 20.30 billion</profit>
			</manufacturer>
			<cost>28 million USD</cost>
			<range>1967 km</range>
		</aircraft>
		<aircraft id = "a5" control = "pilot" role = "bomber">
			<model>F-16 Fighting Falcon</model>
			<manufacturer>
				<manufacturer-name>General Dynamics</manufacturer-name>
				<established>1899</established>
				<staff-count>92200</staff-count>
				<profit>31.513 милярда</profit>
			</manufacturer>
			<cost>14.6 милиона долара</cost>
			<range>1100 километра</range>
		</aircraft>
		<aircraft id = "a6" control = "pilot" role = "bomber">
			<model>F-22 Raptor</model>
			<manufacturer>
				<manufacturer-name>Lockheed Martin</manufacturer-name>
				<established>1995</established>
				<staff-count>116000</staff-count>
				<profit>$2.981 милярда</profit>
			</manufacturer>
			<cost>150 милиона долара</cost>
			<range>2960 км</range>
		</aircraft>
		<aircraft id = "a7" control = "pilot" role = "bomber">
			<model>B-2 Spirit</model>
			<manufacturer>
				<manufacturer-name>Northrop Grumman</manufacturer-name>
				<established>1994</established>
				<staff-count>68100</staff-count>
				<profit>1.952 милярда</profit>
			</manufacturer>
			<cost>737 милиона долара</cost>
			<range>11100 км</range>
		</aircraft>
		<aircraft id = "a8" control = "pilot" role = "bomber">
			<model>EA-18G Growler</model>
			<manufacturer>
				<manufacturer-name>Boeing</manufacturer-name>
				<established>1916</established>
				<staff-count>168421</staff-count>
				<profit>$4.585 милярда</profit>
			</manufacturer>
			<cost>68.2 милиона долара</cost>
			<range>2346 км</range>
		</aircraft>
		<aircraft id = "a9" control = "pilot" role = "bomber">
			<model>F-35 Lightning II</model>
			<manufacturer>
				<manufacturer-name>Lockheed Martin Aeronautics</manufacturer-name>
				<established>1995</established>
				<staff-count>116000</staff-count>
				<profit>$2.981 милярда</profit>
			</manufacturer>
			<cost>142 милиона долара</cost>
			<range>2220 км</range>
		</aircraft>
	</aircrafts>
	<missions>
		
	</missions>
</aircraft-carrier>